{
  "$schema": "https://json-schema.org/draft/2020-12/schema",
  "$id": "https://tymm.local/schemas/teacher_guide.schema.json",
  "title": "TYMM Teacher Guide Manifest V1.1",
  "type": "object",
  "additionalProperties": false,
  "required": ["schema_version", "document_type", "course_id", "grade", "theme_id", "title", "status", "authority_policy", "source_manifest", "theme_overview", "content_storage", "production_plan", "sections", "known_issues", "validation_contract"],
  "$defs": {
    "status": {"enum": ["PLANNED", "MIGRATION_READY", "IN_PROGRESS", "REVIEW_REQUIRED", "VERIFIED", "BLOCKED"]},
    "section_type": {"enum": ["THEME_OPENING", "READING", "SPEAKING", "LISTENING_VIEWING", "WRITING", "THEME_ASSESSMENT"]},
    "source_ref": {
      "type": "object", "additionalProperties": false,
      "required": ["source_id", "role", "path", "authority_rank", "usage"],
      "properties": {
        "source_id": {"type": "string", "minLength": 1},
        "role": {"type": "string", "minLength": 1},
        "path": {"type": "string", "minLength": 1},
        "authority_rank": {"type": "integer", "minimum": 1},
        "usage": {"type": "string", "minLength": 1}
      }
    },
    "section_index": {
      "type": "object", "additionalProperties": false,
      "required": ["section_id", "title", "section_type", "printed_page_range", "block_id", "block_hours", "outcome_refs", "activity_refs", "lesson_plan_refs", "content_status", "content_ref"],
      "properties": {
        "section_id": {"type": "string", "minLength": 1},
        "title": {"type": "string", "minLength": 1},
        "section_type": {"$ref": "#/$defs/section_type"},
        "printed_page_range": {"type": "string", "minLength": 1},
        "block_id": {"type": ["string", "null"]},
        "block_hours": {"type": ["integer", "null"], "minimum": 1},
        "outcome_refs": {"type": "array", "uniqueItems": true, "items": {"type": "string", "minLength": 1}},
        "activity_refs": {"type": "array", "uniqueItems": true, "items": {"type": "string", "minLength": 1}},
        "lesson_plan_refs": {"type": "array", "uniqueItems": true, "items": {"type": "string", "minLength": 1}},
        "content_status": {"$ref": "#/$defs/status"},
        "content_ref": {"type": "string", "minLength": 1}
      }
    }
  },
  "properties": {
    "schema_version": {"const": "1.1.0"},
    "document_type": {"const": "TYMM_TEACHER_GUIDE_MANIFEST"},
    "course_id": {"type": "string", "minLength": 1},
    "grade": {"type": "integer", "minimum": 1, "maximum": 12},
    "theme_id": {"type": "string", "minLength": 1},
    "title": {"type": "string", "minLength": 1},
    "status": {"$ref": "#/$defs/status"},
    "authority_policy": {
      "type": "array", "minItems": 3,
      "items": {
        "type": "object", "additionalProperties": false,
        "required": ["rank", "source_role", "rule"],
        "properties": {
          "rank": {"type": "integer", "minimum": 1},
          "source_role": {"type": "string", "minLength": 1},
          "rule": {"type": "string", "minLength": 1}
        }
      }
    },
    "source_manifest": {"type": "array", "minItems": 4, "items": {"$ref": "#/$defs/source_ref"}},
    "theme_overview": {
      "type": "object", "additionalProperties": false,
      "required": ["printed_page_range", "core_instruction_hours", "anlama_hours", "anlatma_hours", "outcome_count", "legacy_guide_coverage", "target_guide_coverage", "target_section_count"],
      "properties": {
        "printed_page_range": {"type": "string"},
        "core_instruction_hours": {"type": "integer", "minimum": 1},
        "anlama_hours": {"type": "integer", "minimum": 0},
        "anlatma_hours": {"type": "integer", "minimum": 0},
        "outcome_count": {"type": "integer", "minimum": 1},
        "legacy_guide_coverage": {"type": "string"},
        "target_guide_coverage": {"type": "string"},
        "target_section_count": {"type": "integer", "minimum": 1}
      }
    },
    "content_storage": {
      "type": "object", "additionalProperties": false,
      "required": ["entrypoint_policy", "section_directory", "section_schema_path", "render_order_source"],
      "properties": {
        "entrypoint_policy": {"const": "MANIFEST_PLUS_SECTION_FILES"},
        "section_directory": {"type": "string", "minLength": 1},
        "section_schema_path": {"type": "string", "minLength": 1},
        "render_order_source": {"const": "sections_array_order"}
      }
    },
    "production_plan": {
      "type": "array", "minItems": 1,
      "items": {
        "type": "object", "additionalProperties": false,
        "required": ["phase", "name", "status", "deliverables"],
        "properties": {
          "phase": {"type": "integer", "minimum": 1},
          "name": {"type": "string", "minLength": 1},
          "status": {"$ref": "#/$defs/status"},
          "deliverables": {"type": "array", "minItems": 1, "items": {"type": "string", "minLength": 1}}
        }
      }
    },
    "sections": {"type": "array", "minItems": 1, "items": {"$ref": "#/$defs/section_index"}},
    "known_issues": {
      "type": "array",
      "items": {
        "type": "object", "additionalProperties": false,
        "required": ["issue_id", "severity", "status", "description", "source_refs", "resolution_rule"],
        "properties": {
          "issue_id": {"type": "string", "minLength": 1},
          "severity": {"enum": ["INFO", "WARNING", "ERROR"]},
          "status": {"enum": ["OPEN", "RESOLVED", "ACCEPTED"]},
          "description": {"type": "string", "minLength": 1},
          "source_refs": {"type": "array", "minItems": 1, "items": {"type": "string", "minLength": 1}},
          "resolution_rule": {"type": "string", "minLength": 1}
        }
      }
    },
    "validation_contract": {
      "type": "object", "additionalProperties": false,
      "required": ["required_checks", "current_status"],
      "properties": {
        "required_checks": {"type": "array", "minItems": 1, "uniqueItems": true, "items": {"type": "string", "minLength": 1}},
        "current_status": {"enum": ["NOT_RUN", "PASS", "PASS_WITH_WARNINGS", "FAIL"]}
      }
    }
  }
}
