{
  "schema_version": "1.1.0",
  "document_type": "TYMM_TEACHER_GUIDE_MANIFEST",
  "course_id": "TDE_11",
  "grade": 11,
  "theme_id": "TEMA_03",
  "title": "3. TEMA: YAŞAMIN İZİNDE — Öğretmen Rehberi",
  "status": "REVIEW_REQUIRED",
  "authority_policy": [
    {
      "rank": 1,
      "source_role": "NORMATIVE_PROGRAM",
      "rule": "Öğrenme çıktıları ve normatif gerekliliklerde öğretim programı belirleyicidir."
    },
    {
      "rank": 2,
      "source_role": "OFFICIAL_TEXTBOOK_PDF",
      "rule": "Kitaptaki soru, yönerge, metin bağlamı, tablo/form, sayfa akışı ve öğrenci görevinin birincil kaynağı resmî ders kitabı PDF’sidir."
    },
    {
      "rank": 3,
      "source_role": "OFFICIAL_TEXTBOOK_MAP",
      "rule": "PDF’nin sayfa, bölüm, etkinlik ve form kimliklerini indeksleyen türetilmiş yardımcı kaynaktır; PDF’nin yerine geçmez."
    },
    {
      "rank": 4,
      "source_role": "PROGRAM_TEXTBOOK_ALIGNMENT",
      "rule": "Program-kitap çapraz eşleştirmesini doğrular; PDF veya programı geçersiz kılamaz."
    },
    {
      "rank": 5,
      "source_role": "IMPLEMENTATION_PLANS",
      "rule": "Ders içi uygulama önerisidir; üst kaynaklarla çatışırsa resmî program/PDF eşleşmesi korunur."
    }
  ],
  "source_manifest": [
    {
      "source_id": "curriculum_normative",
      "role": "NORMATIVE_PROGRAM",
      "path": "courses/TDE_11/curriculum_normative_text.json",
      "authority_rank": 1,
      "usage": "Öğrenme çıktıları ve normatif tema gereklilikleri."
    },
    {
      "source_id": "curriculum_map",
      "role": "PROGRAM_INDEX",
      "path": "courses/TDE_11/curriculum_map.json",
      "authority_rank": 1,
      "usage": "Tema ve öğrenme çıktısı kimliklerini çözümler."
    },
    {
      "source_id": "official_textbook_pdf",
      "role": "OFFICIAL_TEXTBOOK_PDF",
      "path": "courses/TDE_11/source_docs/turk-dili-ve-edebiyati-11sinif-ders-kitabi_compressed.pdf",
      "authority_rank": 2,
      "usage": "Tema 3 basılı s.160-235 soru, yönerge, metin bağlamı ve sayfa yapısının canonical kaynağı."
    },
    {
      "source_id": "textbook_map",
      "role": "OFFICIAL_TEXTBOOK_MAP",
      "path": "courses/TDE_11/textbook_map.json",
      "authority_rank": 3,
      "usage": "PDF’den türetilmiş sayfa, bölüm, etkinlik ve form konumlandırma indeksi."
    },
    {
      "source_id": "theme_alignment",
      "role": "PROGRAM_TEXTBOOK_ALIGNMENT",
      "path": "courses/TDE_11/themes/tema_03/alignment.json",
      "authority_rank": 4,
      "usage": "Tema 3 program-kitap eşleşmesi."
    },
    {
      "source_id": "lesson_plan_set",
      "role": "IMPLEMENTATION_PLANS",
      "path": "courses/TDE_11/generated/lesson_plans/TEMA_03",
      "authority_rank": 5,
      "usage": "Sınıf içi uygulama, süre ve kanıt toplama önerileri."
    }
  ],
  "theme_overview": {
    "printed_page_range": "160-235",
    "core_instruction_hours": 43,
    "anlama_hours": 23,
    "anlatma_hours": 20,
    "outcome_count": 16,
    "legacy_guide_coverage": "YOK",
    "target_guide_coverage": "160-235",
    "target_section_count": 7
  },
  "content_storage": {
    "entrypoint_policy": "MANIFEST_PLUS_SECTION_FILES",
    "section_directory": "courses/TDE_11/teacher_guide/TEMA_03/sections",
    "section_schema_path": "skill/tymm-material-planner/schemas/teacher_guide_section.schema.json",
    "render_order_source": "sections_array_order"
  },
  "production_plan": [
    {
      "phase": 1,
      "name": "Kaynak ve yapı doğrulama",
      "status": "VERIFIED",
      "deliverables": [
        "Resmî PDF Tema 3 s.160-235 doğrudan çıkarıldı",
        "textbook_map/alignment etkinlik→çıktı eşleşmeleri doğrulandı",
        "43 saat/16 çıktı kapsamı donduruldu"
      ]
    },
    {
      "phase": 2,
      "name": "PDF-temelli öğretmen rehberi üretimi",
      "status": "VERIFIED",
      "deliverables": [
        "Tema açılışı",
        "Huzur okuması",
        "biyografi/tezkire okuması",
        "hayalî mülakat",
        "radyo tiyatrosu dinleme/izleme",
        "tür dönüştürme yazması",
        "16 soruluk tema sonu ölçme"
      ]
    },
    {
      "phase": 3,
      "name": "Çapraz-kaynak doğrulama",
      "status": "VERIFIED",
      "deliverables": [
        "7 activity→outcome plan kayması onarımı",
        "JSON schema/page nesting",
        "16 çıktı/43 saat",
        "QR/rubrik/media sınırları"
      ]
    },
    {
      "phase": 4,
      "name": "Deterministik yayın",
      "status": "PLANNED",
      "deliverables": [
        "Manifest+section JSON→Markdown",
        "JSON→EPUB/HTML",
        "İsteğe bağlı PDF"
      ]
    }
  ],
  "sections": [
    {
      "section_id": "T3_GUIDE_SEC_00_TEMA_ACILIS",
      "title": "Tema Açılışı / Temaya Başlarken",
      "section_type": "THEME_OPENING",
      "printed_page_range": "160-163",
      "block_id": null,
      "block_hours": null,
      "outcome_refs": [],
      "activity_refs": [],
      "lesson_plan_refs": [],
      "content_status": "VERIFIED",
      "content_ref": "courses/TDE_11/teacher_guide/TEMA_03/sections/00_tema_acilisi.json"
    },
    {
      "section_id": "T3_SEC_01_OKUMA_HUZUR",
      "title": "Metin Tahlili-1 (Anlama): Okuma — Huzur",
      "section_type": "READING",
      "printed_page_range": "164-193",
      "block_id": "BLOCK_T3_01_OKUMA",
      "block_hours": 15,
      "outcome_refs": [
        "TDE2.1",
        "TDE2.2",
        "TDE2.3",
        "TDE2.4"
      ],
      "activity_refs": [
        "T3_ACT_01_OKUMA_YONETIM",
        "T3_ACT_02_OKUMA_ICERIK_ANLAM",
        "T3_ACT_03_OKUMA_UYGULAMA_COZUMLEME",
        "T3_ACT_04_OKUMA_DEGERLENDIRME"
      ],
      "lesson_plan_refs": [
        "courses/TDE_11/generated/lesson_plans/TEMA_03/BLOCK_T3_01_OKUMA/BLOCK_T3_01_OKUMA_P01.json",
        "courses/TDE_11/generated/lesson_plans/TEMA_03/BLOCK_T3_01_OKUMA/BLOCK_T3_01_OKUMA_P02.json",
        "courses/TDE_11/generated/lesson_plans/TEMA_03/BLOCK_T3_01_OKUMA/BLOCK_T3_01_OKUMA_P03.json",
        "courses/TDE_11/generated/lesson_plans/TEMA_03/BLOCK_T3_01_OKUMA/BLOCK_T3_01_OKUMA_P04.json"
      ],
      "content_status": "VERIFIED",
      "content_ref": "courses/TDE_11/teacher_guide/TEMA_03/sections/01_okuma_huzur.json"
    },
    {
      "section_id": "T3_SEC_02_OKUMA_BIYOGRAFI",
      "title": "Metin Tahlili-2 (Anlama): Okuma — Biyografi / Tezkire",
      "section_type": "READING",
      "printed_page_range": "194-209",
      "block_id": "BLOCK_T3_01_OKUMA",
      "block_hours": 15,
      "outcome_refs": [
        "TDE2.1",
        "TDE2.2",
        "TDE2.3",
        "TDE2.4"
      ],
      "activity_refs": [
        "T3_ACT_05_OKUMA_YONETIM",
        "T3_ACT_06_OKUMA_ICERIK_ANLAM",
        "T3_ACT_07_OKUMA_UYGULAMA_COZUMLEME",
        "T3_ACT_08_OKUMA_DEGERLENDIRME"
      ],
      "lesson_plan_refs": [
        "courses/TDE_11/generated/lesson_plans/TEMA_03/BLOCK_T3_01_OKUMA/BLOCK_T3_01_OKUMA_P05.json",
        "courses/TDE_11/generated/lesson_plans/TEMA_03/BLOCK_T3_01_OKUMA/BLOCK_T3_01_OKUMA_P06.json",
        "courses/TDE_11/generated/lesson_plans/TEMA_03/BLOCK_T3_01_OKUMA/BLOCK_T3_01_OKUMA_P07.json",
        "courses/TDE_11/generated/lesson_plans/TEMA_03/BLOCK_T3_01_OKUMA/BLOCK_T3_01_OKUMA_P08.json"
      ],
      "content_status": "VERIFIED",
      "content_ref": "courses/TDE_11/teacher_guide/TEMA_03/sections/02_okuma_biyografi_tezkire.json"
    },
    {
      "section_id": "T3_SEC_03_KONUSMA_MULAKAT",
      "title": "Edebiyat Atölyesi-1 (Anlatma): Konuşma — Huzur Kişisiyle Hayalî Mülakat",
      "section_type": "SPEAKING",
      "printed_page_range": "210-214",
      "block_id": "BLOCK_T3_02_KONUSMA",
      "block_hours": 10,
      "outcome_refs": [
        "TDE3.1",
        "TDE3.2",
        "TDE3.3",
        "TDE3.4"
      ],
      "activity_refs": [
        "T3_ACT_09_KONUSMA_YONETIM",
        "T3_ACT_10_KONUSMA_ICERIK_ANLAM",
        "T3_ACT_11_KONUSMA_UYGULAMA_COZUMLEME",
        "T3_ACT_12_KONUSMA_DEGERLENDIRME"
      ],
      "lesson_plan_refs": [
        "courses/TDE_11/generated/lesson_plans/TEMA_03/BLOCK_T3_02_KONUSMA/BLOCK_T3_02_KONUSMA_P01.json",
        "courses/TDE_11/generated/lesson_plans/TEMA_03/BLOCK_T3_02_KONUSMA/BLOCK_T3_02_KONUSMA_P02.json",
        "courses/TDE_11/generated/lesson_plans/TEMA_03/BLOCK_T3_02_KONUSMA/BLOCK_T3_02_KONUSMA_P03.json",
        "courses/TDE_11/generated/lesson_plans/TEMA_03/BLOCK_T3_02_KONUSMA/BLOCK_T3_02_KONUSMA_P04.json",
        "courses/TDE_11/generated/lesson_plans/TEMA_03/BLOCK_T3_02_KONUSMA/BLOCK_T3_02_KONUSMA_P05.json"
      ],
      "content_status": "REVIEW_REQUIRED",
      "content_ref": "courses/TDE_11/teacher_guide/TEMA_03/sections/03_konusma_mulakat.json"
    },
    {
      "section_id": "T3_SEC_04_DINLEME_RADYO",
      "title": "Metin Tahlili-3 (Anlama): Dinleme / İzleme — Direnişin Ustaları Radyo Tiyatrosu",
      "section_type": "LISTENING_VIEWING",
      "printed_page_range": "215-224",
      "block_id": "BLOCK_T3_03_DINLEME",
      "block_hours": 8,
      "outcome_refs": [
        "TDE1.1",
        "TDE1.2",
        "TDE1.3",
        "TDE1.4"
      ],
      "activity_refs": [
        "T3_ACT_13_DINLEME_YONETIM",
        "T3_ACT_14_DINLEME_ICERIK_ANLAM",
        "T3_ACT_15_DINLEME_UYGULAMA_COZUMLEME",
        "T3_ACT_16_DINLEME_DEGERLENDIRME"
      ],
      "lesson_plan_refs": [
        "courses/TDE_11/generated/lesson_plans/TEMA_03/BLOCK_T3_03_DINLEME/BLOCK_T3_03_DINLEME_P01.json",
        "courses/TDE_11/generated/lesson_plans/TEMA_03/BLOCK_T3_03_DINLEME/BLOCK_T3_03_DINLEME_P02.json",
        "courses/TDE_11/generated/lesson_plans/TEMA_03/BLOCK_T3_03_DINLEME/BLOCK_T3_03_DINLEME_P03.json",
        "courses/TDE_11/generated/lesson_plans/TEMA_03/BLOCK_T3_03_DINLEME/BLOCK_T3_03_DINLEME_P04.json"
      ],
      "content_status": "REVIEW_REQUIRED",
      "content_ref": "courses/TDE_11/teacher_guide/TEMA_03/sections/04_dinleme_radyo_tiyatrosu.json"
    },
    {
      "section_id": "T3_SEC_05_YAZMA_DONUSTURME",